"Income of Immigrant tax-filers, by immigrant admission category and tax year, for Canada and provinces, 2019 constant dollars 1 2 3"
"Frequency: Annual"
"Table: 43-10-0026-01"
"Release date: 2021-12-06"
"Geography: Canada, Geographical region of Canada, Province or territory"
""
""

"Geography 4","Canada",,,,,"Newfoundland and Labrador",,,,,"Prince Edward Island",,,,,"Nova Scotia",,,,,"New Brunswick",,,,,"Quebec",,,,,"Ontario",,,,,"Manitoba",,,,,"Saskatchewan",,,,,"Alberta",,,,,"British Columbia",,,,,"Territories",,,,
"Sex 5","Total, sex 5",,,,,"Total, sex 5",,,,,"Total, sex 5",,,,,"Total, sex 5",,,,,"Total, sex 5",,,,,"Total, sex 5",,,,,"Total, sex 5",,,,,"Total, sex 5",,,,,"Total, sex 5",,,,,"Total, sex 5",,,,,"Total, sex 5",,,,,"Total, sex 5",,,,
"Pre-admission experience","Total, pre-admission experience",,,,,"Total, pre-admission experience",,,,,"Total, pre-admission experience",,,,,"Total, pre-admission experience",,,,,"Total, pre-admission experience",,,,,"Total, pre-admission experience",,,,,"Total, pre-admission experience",,,,,"Total, pre-admission experience",,,,,"Total, pre-admission experience",,,,,"Total, pre-admission experience",,,,,"Total, pre-admission experience",,,,,"Total, pre-admission experience",,,,
"Knowledge of official languages at admission","Total, knowledge of official languages",,,,,"Total, knowledge of official languages",,,,,"Total, knowledge of official languages",,,,,"Total, knowledge of official languages",,,,,"Total, knowledge of official languages",,,,,"Total, knowledge of official languages",,,,,"Total, knowledge of official languages",,,,,"Total, knowledge of official languages",,,,,"Total, knowledge of official languages",,,,,"Total, knowledge of official languages",,,,,"Total, knowledge of official languages",,,,,"Total, knowledge of official languages",,,,
"Admission year 6","2009, admission year",,,,,"2009, admission year",,,,,"2009, admission year",,,,,"2009, admission year",,,,,"2009, admission year",,,,,"2009, admission year",,,,,"2009, admission year",,,,,"2009, admission year",,,,,"2009, admission year",,,,,"2009, admission year",,,,,"2009, admission year",,,,,"2009, admission year",,,,
"Statistics 8 9 10 11 12 13 14 15 16 17","Median wages, salaries and commissions 13 17",,,,,"Median wages, salaries and commissions 13 17",,,,,"Median wages, salaries and commissions 13 17",,,,,"Median wages, salaries and commissions 13 17",,,,,"Median wages, salaries and commissions 13 17",,,,,"Median wages, salaries and commissions 13 17",,,,,"Median wages, salaries and commissions 13 17",,,,,"Median wages, salaries and commissions 13 17",,,,,"Median wages, salaries and commissions 13 17",,,,,"Median wages, salaries and commissions 13 17",,,,,"Median wages, salaries and commissions 13 17",,,,,"Median wages, salaries and commissions 13 17",,,,
"Immigrant admission category 7","2015","2016","2017","2018","2019","2015","2016","2017","2018","2019","2015","2016","2017","2018","2019","2015","2016","2017","2018","2019","2015","2016","2017","2018","2019","2015","2016","2017","2018","2019","2015","2016","2017","2018","2019","2015","2016","2017","2018","2019","2015","2016","2017","2018","2019","2015","2016","2017","2018","2019","2015","2016","2017","2018","2019","2015","2016","2017","2018","2019"
,"Dollars",,,,,,,,,,,,,,,,,,,,,,,,,,,,,,,,,,,,,,,,,,,,,,,,,,,,,,,,,,,
"Total, immigrant admission category","31,200","32,100","33,700","35,700","36,900","35,200","40,700","45,600","45,100","47,100","17,500","23,200","22,300","21,500","27,500","31,600","32,000","33,100","35,200","36,100","25,400","31,300","32,500","31,800","31,900","28,900","30,400","32,500","34,500","36,500","29,200","30,500","31,900","34,500","35,300","32,700","33,500","34,400","35,000","35,700","39,500","38,800","39,900","40,700","41,300","41,100","40,600","41,100","42,400","43,100","28,800","30,700","32,500","34,400","36,400","45,900","49,900","53,000","58,300","60,100"
"Immigrants sponsored by family","26,800","28,000","29,400","31,600","33,000","42,400","41,900","41,800","43,500","46,100","25,100","27,800","27,100","28,900","33,000","37,300","39,800","38,000","42,100","42,300","28,100","31,500","36,800","31,400","31,600","23,900","24,400","26,000","28,000","30,400","26,200","27,500","28,800","31,500","32,100","30,600","33,200","32,500","35,200","35,500","29,700","30,000","34,400","35,800","36,100","33,300","33,000","33,500","35,400","36,000","25,200","27,200","29,600","31,500","34,500","42,400","47,300","52,500","52,000","56,200"
"Sponsored spouse or partner","29,300","30,400","31,600","33,700","34,600","45,500","42,800","45,400","51,600","50,500","27,000","27,500","28,000","32,000","34,600","41,600","43,000","40,200","42,700","42,800","29,200","32,800","37,700","33,400","39,000","24,700","25,100","26,500","28,800","31,000","28,500","29,700","30,900","33,300","33,500","32,200","34,900","34,000","36,900","37,800","31,400","30,800","34,700","37,500","36,000","35,900","35,700","36,000","38,100","38,000","29,600","31,600","34,200","34,900","36,700","51,400","53,600","56,700","56,000","59,800"
"Sponsored parent or grandparent","18,400","19,400","21,000","22,900","24,200","0","0","0","0","..","0","..","0","0","..","0","0","0","0","..","0","0","0","0","..","16,800","17,700","20,100","22,300","23,500","19,300","20,800","22,400","24,400","24,000","23,800","25,000","24,100","24,500","24,000","15,600","17,800","20,100","20,800","24,500","23,100","23,000","23,400","24,500","27,400","14,000","15,000","16,900","20,100","23,600","0","0","0","0",".."
"Other immigrant sponsored by family","26,400","26,900","29,000","31,100","32,100","35,800","38,000","36,200","34,000","39,800","0","0","0","0","..","23,800","29,800","28,700","36,600","39,800","12,000","0","0","14,200","17,800","22,600","23,300","25,300","27,400","29,100","26,700","27,400","29,400","32,400","32,600","26,400","30,900","31,000","27,700","26,100","31,400","27,200","36,800","36,100","39,700","35,400","33,600","36,100","34,500","35,400","25,200","27,000","28,400","31,400","33,500","23,700","18,900","22,100","29,400","42,600"
"Economic Immigrant, principal applicant","45,400","47,100","49,500","51,700","53,800","68,500","62,700","76,300","74,300","77,000","35,400","40,900","35,200","40,400","50,300","51,800","53,800","56,500","56,400","58,500","46,400","48,600","50,900","49,900","52,800","38,700","41,400","44,200","47,600","50,700","44,600","47,100","49,800","52,000","54,000","42,600","43,500","45,200","45,700","46,700","54,900","53,500","54,700","56,800","56,300","61,500","59,900","61,900","63,300","63,800","43,800","46,400","48,700","50,600","52,000","58,000","58,700","64,000","72,500","72,300"
"Skilled worker and skilled trades, principal applicant","47,500","50,000","53,300","56,000","59,000","110,100","96,700","102,700","98,900","99,200","0","50,700","0","40,200","..","56,500","59,800","60,600","59,800","65,800","60,300","62,400","72,400","71,300","70,900","40,200","42,900","45,900","49,300","52,500","51,900","54,900","58,500","61,200","63,400","59,800","62,800","63,800","62,700","64,200","58,100","62,900","61,300","65,600","68,900","66,100","64,400","67,100","70,000","71,500","46,800","49,700","53,500","55,500","58,800","78,300","79,900","78,800","90,200","101,900"
"Canadian experience class, principal applicant","63,200","67,800","69,700","73,500","73,300","0","0","0","0","..","0","0","0","0","..","0","0","0","0","..","0","0","0","0","..","0","0","47,900","51,400","..","65,100","71,200","73,500","77,600","76,300","0","0","0","0","..","0","0","0","0","..","69,200","66,100","68,300","73,800","77,800","49,700","56,400","60,200","63,800","61,400","0","0","0","0",".."
"Provincial/territorial nominee, principal applicant","51,500","51,500","53,300","55,100","55,400","50,700","52,900","56,800","70,200","61,500","33,100","35,000","32,000","36,500","43,900","49,700","50,500","56,500","56,100","54,700","37,600","37,400","44,400","42,600","45,600","42,200","44,400","48,800","46,900","47,000","49,100","52,000","52,800","52,800","54,500","42,400","43,100","44,700","45,500","46,400","55,300","53,400","54,800","56,700","55,900","69,100","65,200","68,600","70,700","69,100","59,800","61,100","62,900","65,900","66,400","51,200","47,400","50,200","59,600","50,600"
"Business programs, principal applicant","22,800","24,400","24,000","24,500","24,000","..","..","..","..","..","0","0","0","0","..","0","0","0","0","..","..","..","..","0","..","18,900","23,000","21,500","23,600","24,400","22,400","22,800","24,000","24,600","24,500","0","0","0","0","..","0","0","0","0","..","26,600","26,000","20,600","28,500","28,800","23,600","25,300","24,000","24,200","23,100","0","0","0","0",".."
"Caregiver, principal applicant","33,300","34,500","36,400","38,000","38,900","0","0","0","0","..","0","0","..","..","..","33,900","24,900","24,600","27,100","27,200","0","0","0","34,100","38,300","23,400","24,100","24,500","26,000","27,500","31,100","33,000","34,500","36,900","38,000","35,900","38,300","38,800","39,500","40,700","43,300","42,400","42,400","40,600","37,500","46,100","46,700","47,100","48,900","49,900","34,300","36,100","38,000","39,000","40,400","72,000","62,100","72,600","84,000",".."
"Economic Immigrant, spouse and dependent","24,300","25,200","26,300","28,600","30,000","12,400","10,900","25,600","22,700","18,400","13,200","14,600","17,100","18,500","22,400","18,800","18,300","20,400","20,400","22,200","15,700","16,000","18,500","20,300","19,300","22,600","23,500","24,500","25,600","26,700","23,300","24,500","25,900","29,500","30,600","25,000","25,400","26,600","27,400","28,000","29,500","29,600","30,700","31,700","32,600","31,400","30,900","31,500","32,600","34,300","21,500","22,900","24,100","26,500","28,700","39,600","40,600","44,800","52,900","51,700"
"Skilled worker and skilled trades, spouse and dependent","24,600","25,400","26,700","29,200","30,400","12,300","9,500","27,300","26,900","22,400","0","13,300","15,700","20,500","23,400","21,600","22,000","22,100","23,300","21,100","22,200","25,400","27,900","33,100","30,200","22,900","24,200","25,000","26,000","26,900","24,100","25,100","26,500","30,000","31,400","25,300","28,200","28,100","27,800","33,100","30,300","31,500","38,900","40,600","41,500","32,100","31,200","31,300","32,900","34,700","22,900","24,600","26,600","28,900","30,300","29,700","46,500","52,300","68,400","85,300"
"Canadian experience class, spouse and dependent","30,900","29,900","30,700","32,900","35,000","..","..","..","..","..","..","..","..","..","..","0","0","0","0","..","0","0","0","0","..","0","0","0","0","..","32,100","30,900","31,700","36,400","36,800","0","0","0","0","..","0","0","0","0","..","28,700","27,100","25,600","29,800","35,300","28,900","35,600","37,800","31,100","31,000","0","0","0","0",".."
"Provincial/territorial nominee, spouse and dependent","24,300","24,800","25,700","26,800","27,800","12,400","15,300","14,800","15,400","18,300","13,000","14,900","18,400","18,400","22,500","17,100","15,400","18,900","19,100","22,700","13,700","14,700","15,100","14,700","15,000","13,700","16,200","18,100","18,500","19,800","16,500","17,800","18,900","22,700","23,000","24,900","25,300","26,400","27,200","27,500","29,200","29,400","29,800","30,700","31,400","28,000","27,600","29,100","30,100","31,100","21,000","22,600","22,400","24,200","26,700","38,500","33,100","37,200","42,200","43,700"
"Business programs, spouse and dependent","13,000","14,500","16,600","19,400","21,000","0","..","..","..","..","0","0","0","0","..","27,900","19,100","26,400","14,700","20,100","0","0","0","0","..","15,000","13,600","14,500","19,000","18,900","13,700","14,300","18,000","20,400","21,300","0","0","0","0","..","0","0","0","0","..","24,000","25,600","24,000","31,500","30,000","11,800","14,000","15,100","18,400","20,400","0","0","0","0",".."
"Caregiver, spouse and dependent","29,600","30,200","31,400","33,400","34,900","0","0","0","0","..","..","..","..","..","..","0","0","0","31,000","18,000","0","0","0","0","..","22,900","22,200","24,200","25,100","27,300","28,500","29,500","30,500","33,300","34,600","29,300","28,300","31,200","33,600","36,100","42,800","32,500","45,300","47,000","48,500","37,700","37,500","39,400","39,400","40,300","30,600","31,900","32,500","34,400","36,400","42,600","57,300","51,500","57,900","52,000"
"Refugee","23,100","23,600","25,100","27,300","28,100","22,300","16,000","27,000","26,600","34,700","8,900","12,000","14,800","15,600","18,100","13,800","18,700","18,400","20,700","20,400","23,800","32,500","28,500","28,900","29,700","17,600","18,300","20,500","22,000","23,900","21,700","22,600","24,500","27,500","27,900","23,500","26,300","26,600","26,600","27,700","27,700","27,500","29,600","29,000","30,500","32,700","31,800","33,400","33,500","34,300","22,800","23,800","24,600","26,400","27,400","26,300","37,200","45,300","57,100","62,000"
"Government-assisted refugee","19,700","20,000","21,600","24,100","24,600","19,000","15,700","20,800","37,700","34,700","8,700","12,000","14,800","14,900","16,700","14,000","21,100","18,000","18,800","20,400","23,400","26,600","26,700","28,900","29,600","14,600","14,400","16,800","18,600","18,500","14,700","16,300","18,000","22,100","21,800","23,400","23,500","24,400","26,400","26,300","27,500","26,500","25,300","27,900","31,200","29,200","30,100","31,600","31,200","32,600","19,400","22,400","23,300","21,600","24,800","0","0","0","0",".."
"Privately sponsored refugee","23,300","24,300","25,200","27,100","27,800","0","0","0","0","..","..","..","..","..","..","0","0","0","0","..","0","0","0","0","..","15,600","17,000","17,500","19,400","24,200","20,900","22,200","23,400","25,900","26,000","23,200","27,600","28,000","26,600","29,800","27,000","29,100","33,000","30,600","31,200","33,400","33,400","33,800","34,200","34,600","22,400","23,600","24,300","25,900","23,800","0","0","0","0","34,600"
"Blended sponsorship refugee","..","..","..","..","..","..","..","..","..","..","..","..","..","..","..","..","..","..","..","..","..","..","..","..","..","..","..","..","..","..","..","..","..","..","..","..","..","..","..","..","..","..","..","..","..","..","..","..","..","..","..","..","..","..","..","..","..","..","..",".."
"Protected person in Canada","27,600","28,400","30,200","32,100","33,300","0","0","..","..","..","0","0","0","0","..","0","0","0","0","..","0","0","0","0","..","24,100","25,600","26,400","29,200","31,400","26,700","28,000","30,300","32,200","32,600","0","28,000","24,100","31,100","..","37,700","26,700","36,200","38,600","36,600","46,900","41,200","45,400","45,100","43,100","31,000","28,000","27,300","30,400","34,800","0","0","0","0",".."
"Dependent abroad of a protected person in Canada","17,700","17,300","20,300","21,700","23,900","0","0","0","0","..","..","..","..","..","..","0","0","0","0","..","0","0","0","0","..","14,000","14,400","17,500","17,700","19,500","17,600","17,500","20,300","22,700","24,300","0","0","32,200","27,300","39,600","27,700","19,700","27,200","19,800","19,100","23,900","20,900","23,200","27,200","28,100","21,200","25,900","27,400","31,100","30,000","0","0","0","0",".."
"Other immigrant","25,300","26,600","28,700","30,400","31,200","0","0","0","0","..","0","..","..","..","..","0","0","0","0","..","..","..","..","..","..","23,300","22,200","26,200","26,100","26,400","24,600","27,600","29,900","31,700","32,700","23,700","23,900","27,800","28,400","26,200","0","0","27,100","0","..","42,500","39,700","40,400","41,000","44,500","25,000","24,400","27,100","24,500","27,900","0","0","0","0",".."

Symbol legend:
.., not available for a specific reference period






Footnotes:
1,"This table uses the Longitudinal Immigration Database (IMDB), an administrative database that combines data from Immigration, Refugees and Citizenship Canada (IRCC) with tax files. This table includes statistics of immigrant taxfilers who were 15 years of age or older at year of taxation.  For further details, please refer to the <a href="https://www150.statcan.gc.ca/n1/pub/11-633-x/11-633-x2021008-eng.htm">Longitudinal Immigration Database (IMDB) Technical Report, 2020</a>."
2,"The reference periods indicate the years in which immigrants filed taxes. For example, 2015 refers to the tax year of 2015 and 2019 refers to the tax year of 2019."
3,"Table 43-10-0026-01 replaces the archived table 43-10-0016-01."
4,"Geography refers to the province at taxation."
5,"Other cases not stated may be included in total but not shown as a category."
6,"Admission year is the year in which an immigrant first obtained their landed immigrant/permanent resident status. This may or may not be the same as the year of arrival."
7,"Immigrant admission category refers to the category under which immigrants are admitted to Canada by immigration authorities. For further information, please refer to the <a href="http://www23.statcan.gc.ca/imdb/p3VD.pl?Function=getVD&TVD=323293">Classification of admission category of immigrant</a>."
8,"The total number of residents represents the number of immigrant taxfilers residing in the specified geography on December 31st of the corresponding tax year."
9,"Social assistance benefits are family level financial assistance/benefits provided by federal and/or provincial programs."
10,"Incidence is the proportion of immigrant taxfilers with this type of income."
11,"Employment income is the sum of wages, salaries, commissions, and self-employment income."
12,"Total income includes the taxfiler’s income from taxable sources (for example, all market incomes such as employment earnings) as well as non-taxable sources (for example, government transfers such as social assistance or child benefits)."
13,"The wages, salaries and commissions category is the sum of T4 earnings (line 101 on the income tax form) and other employment income (line 104)."
14,"If tax year is 1988 or later, self-employment income is the sum of self-employment income (from business (line 135), professional (line 137), commission (line 139), farming (line 141) or fishing (line 143) income) and limited partnership (line 122) income. If tax year is prior to 1988, then limited partnership income is not included."
15,"Employment insurance benefits are income paid to individuals experiencing paid-employment income interruptions or those who stop working because of sickness, injury, pregnancy, birth or adoption of a child. Prior to 1996, these benefits were referred to as Unemployment Insurance Benefits."
16,"Investment income is the sum of dividend income (line 120), interest and other investment income (line 121) and taxable capital gains (line 127)."
17,"Income values are adjusted to 2019 constant dollars. Values zero and one are not included in medians."



"How to cite: Statistics Canada. Table 43-10-0026-01  Income of Immigrant tax-filers, by immigrant admission category and tax year, for Canada and provinces, 2019 constant dollars"
https://www150.statcan.gc.ca/t1/tbl1/en/tv.action?pid=4310002601